[
{
  "id": "scene_sec_001_0",
  "title": "At the Beach 1",
  "section_ref": "sec_001",
  "voiceover_lines": [
    {
      "text": "Let us learn about At the Beach 1..",
      "duration_seconds": 3.2,
      "pause_after": 0.5,
      "audio_path": "D:\\new_video_pip\\packages\\textbook-pipeline\\projects\\english_pipeline_output\\audio\\scene_sec_001_0_line_1.mp3"
    },
    {
      "text": "Pay attention to At the Beach 1.",
      "duration_seconds": 2.8,
      "pause_after": 0.0,
      "audio_path": "D:\\new_video_pip\\packages\\textbook-pipeline\\projects\\english_pipeline_output\\audio\\scene_sec_001_0_line_2.mp3"
    }
  ],
  "scene_steps": [
    {
      "type": "title",
      "text": "At the Beach 1",
      "at": 0.0,
      "duration": 1.3333333333333333
    },
    {
      "type": "text",
      "text": "Let us learn about At the Beach 1..",
      "at": 2.0,
      "duration": 2.6666666666666665
    },
    {
      "type": "text",
      "text": "Pay attention to At the Beach 1.",
      "at": 5.0,
      "duration": 2.3333333333333335
    }
  ],
  "duration_seconds": 6.5,
  "notes": ""
},
{
  "id": "scene_sec_002_0",
  "title": "Lesson",
  "section_ref": "sec_002",
  "voiceover_lines": [
    {
      "text": "![](<RPS - ENGLISH - CLASS 1 - INDIVIDUAL - A (2026) PRINTFILE (2)-pages-2_images/imageFile1.png>).",
      "duration_seconds": 5.2,
      "pause_after": 0.5,
      "audio_path": "D:\\new_video_pip\\packages\\textbook-pipeline\\projects\\english_pipeline_output\\audio\\scene_sec_002_0_line_1.mp3"
    },
    {
      "text": "Pay attention to Lesson.",
      "duration_seconds": 1.6,
      "pause_after": 0.0,
      "audio_path": "D:\\new_video_pip\\packages\\textbook-pipeline\\projects\\english_pipeline_output\\audio\\scene_sec_002_0_line_2.mp3"
    }
  ],
  "scene_steps": [
    {
      "type": "title",
      "text": "Lesson",
      "at": 0.0,
      "duration": 1.0
    },
    {
      "type": "text",
      "text": "![](<RPS - ENGLISH - CLASS 1 - INDIVIDUAL - A (2026) PRINTFILE (2)-pages-2_images/imageFile1.png>).",
      "at": 2.0,
      "duration": 4.333333333333333
    },
    {
      "type": "text",
      "text": "Pay attention to Lesson.",
      "at": 5.0,
      "duration": 1.3333333333333333
    }
  ],
  "duration_seconds": 7.7,
  "notes": ""
},
{
  "id": "scene_sec_003_0",
  "title": "Warm Up",
  "section_ref": "sec_003",
  "voiceover_lines": [
    {
      "text": "Look at the picture. What do you see? Talk about any 3 of them.",
      "duration_seconds": 5.6,
      "pause_after": 0.5,
      "audio_path": "D:\\new_video_pip\\packages\\textbook-pipeline\\projects\\english_pipeline_output\\audio\\scene_sec_003_0_line_1.mp3"
    },
    {
      "text": "Cloud Palm Tree Sea Ball Girl Swimming Ring Sand Starfish Sandcastle.",
      "duration_seconds": 4.4,
      "pause_after": 0.0,
      "audio_path": "D:\\new_video_pip\\packages\\textbook-pipeline\\projects\\english_pipeline_output\\audio\\scene_sec_003_0_line_2.mp3"
    }
  ],
  "scene_steps": [
    {
      "type": "title",
      "text": "Warm Up",
      "at": 0.0,
      "duration": 1.0
    },
    {
      "type": "text",
      "text": "Look at the picture. What do you see? Talk about any 3 of them.",
      "at": 2.0,
      "duration": 4.666666666666667
    },
    {
      "type": "text",
      "text": "Cloud Palm Tree Sea Ball Girl Swimming Ring Sand Starfish Sandcastle.",
      "at": 5.0,
      "duration": 3.6666666666666665
    }
  ],
  "duration_seconds": 10.5,
  "notes": ""
},
{
  "id": "scene_sec_004_0",
  "title": "Read and Enjoy",
  "section_ref": "sec_004",
  "voiceover_lines": [
    {
      "text": "Let us read what Varun and his sister do when they visit a beach with their family. It is a lovely day.",
      "duration_seconds": 8.8,
      "pause_after": 0.5,
      "audio_path": "D:\\new_video_pip\\packages\\textbook-pipeline\\projects\\english_pipeline_output\\audio\\scene_sec_004_0_line_1.mp3"
    },
    {
      "text": "Varun and his sister Vidya are at a beach with their parents. Hey, let us build a sandcastle.",
      "duration_seconds": 7.2,
      "pause_after": 0.5,
      "audio_path": "D:\\new_video_pip\\packages\\textbook-pipeline\\projects\\english_pipeline_output\\audio\\scene_sec_004_0_line_2.mp3"
    },
    {
      "text": "Sure! I have a shovel and a bucket too. Varun and Vidya build a castle together. Look, this room is for Grandpa and Grandma.",
      "duration_seconds": 9.6,
      "pause_after": 0.0,
      "audio_path": "D:\\new_video_pip\\packages\\textbook-pipeline\\projects\\english_pipeline_output\\audio\\scene_sec_004_0_line_3.mp3"
    }
  ],
  "scene_steps": [
    {
      "type": "title",
      "text": "Read and Enjoy",
      "at": 0.0,
      "duration": 1.0
    },
    {
      "type": "text",
      "text": "Let us read what Varun and his sister do when they visit a beach with their family. It is a lovely day.",
      "at": 2.0,
      "duration": 7.333333333333333
    },
    {
      "type": "text",
      "text": "Varun and his sister Vidya are at a beach with their parents. Hey, let us build a sandcastle.",
      "at": 5.0,
      "duration": 6.0
    },
    {
      "type": "word_highlight",
      "text": "Sure! I have a shovel and a bucket too. Varun and Vidya build a castle together.",
      "at": 8.0,
      "duration": 5.333333333333333
    }
  ],
  "duration_seconds": 26.6,
  "notes": ""
},
{
  "id": "scene_sec_005_0",
  "title": "Comprehending Ability",
  "section_ref": "sec_005",
  "voiceover_lines": [
    {
      "text": "Now let us practice. Comprehending Ability.",
      "duration_seconds": 2.4,
      "pause_after": 0.5,
      "audio_path": "D:\\new_video_pip\\packages\\textbook-pipeline\\projects\\english_pipeline_output\\audio\\scene_sec_005_0_line_1.mp3"
    },
    {
      "text": "Look at the question carefully: Complete the exercise about Comprehending Ability.",
      "duration_seconds": 4.4,
      "pause_after": 0.5,
      "audio_path": "D:\\new_video_pip\\packages\\textbook-pipeline\\projects\\english_pipeline_output\\audio\\scene_sec_005_0_line_2.mp3"
    },
    {
      "text": "Think about your answer before you respond.",
      "duration_seconds": 2.8,
      "pause_after": 0.5,
      "audio_path": "D:\\new_video_pip\\packages\\textbook-pipeline\\projects\\english_pipeline_output\\audio\\scene_sec_005_0_line_3.mp3"
    },
    {
      "text": "Great job! Let us check the answer together.",
      "duration_seconds": 3.2,
      "pause_after": 0.0,
      "audio_path": "D:\\new_video_pip\\packages\\textbook-pipeline\\projects\\english_pipeline_output\\audio\\scene_sec_005_0_line_4.mp3"
    }
  ],
  "scene_steps": [
    {
      "type": "question_card",
      "text": "Complete the exercise about Comprehending Ability.",
      "at": 0.0,
      "duration": 2.0
    },
    {
      "type": "worked_step",
      "text": "Read the question carefully and think about what it asks.",
      "at": 2.0,
      "duration": 3.3333333333333335
    },
    {
      "type": "answer_reveal",
      "text": "The correct answer depends on the story you just read. Look back and find the clues!",
      "at": 5.0,
      "duration": 5.333333333333333
    }
  ],
  "duration_seconds": 14.3,
  "notes": ""
},
{
  "id": "scene_sec_006_0",
  "title": "A. Tick ( ) the correct sentences.",
  "section_ref": "sec_006",
  "voiceover_lines": [
    {
      "text": "Now let us practice. A. Tick ( ) the correct sentences..",
      "duration_seconds": 4.4,
      "pause_after": 0.5,
      "audio_path": "D:\\new_video_pip\\packages\\textbook-pipeline\\projects\\english_pipeline_output\\audio\\scene_sec_006_0_line_1.mp3"
    },
    {
      "text": "Look at the question carefully: - a. Varun and Vidya go to a with their family. ( )",
      "duration_seconds": 7.2,
      "pause_after": 0.5,
      "audio_path": "D:\\new_video_pip\\packages\\textbook-pipeline\\projects\\english_pipeline_output\\audio\\scene_sec_006_0_line_2.mp3"
    },
    {
      "text": "Think about your answer before you respond.",
      "duration_seconds": 2.8,
      "pause_after": 0.5,
      "audio_path": "D:\\new_video_pip\\packages\\textbook-pipeline\\projects\\english_pipeline_output\\audio\\scene_sec_006_0_line_3.mp3"
    },
    {
      "text": "Great job! Let us check the answer together.",
      "duration_seconds": 3.2,
      "pause_after": 0.0,
      "audio_path": "D:\\new_video_pip\\packages\\textbook-pipeline\\projects\\english_pipeline_output\\audio\\scene_sec_006_0_line_4.mp3"
    }
  ],
  "scene_steps": [
    {
      "type": "question_card",
      "text": "- a. Varun and Vidya go to a with their family. ( )",
      "at": 0.0,
      "duration": 4.333333333333333
    },
    {
      "type": "worked_step",
      "text": "Read the question carefully and think about what it asks.",
      "at": 2.0,
      "duration": 3.3333333333333335
    },
    {
      "type": "answer_reveal",
      "text": "The correct answer depends on the story you just read. Look back and find the clues!",
      "at": 5.0,
      "duration": 5.333333333333333
    }
  ],
  "duration_seconds": 19.1,
  "notes": ""
},
{
  "id": "scene_sec_007_0",
  "title": "B. Tick whether the following statements are true or false.",
  "section_ref": "sec_007",
  "voiceover_lines": [
    {
      "text": "Now let us practice. B. Tick whether the following statements are true or false..",
      "duration_seconds": 5.6,
      "pause_after": 0.5,
      "audio_path": "D:\\new_video_pip\\packages\\textbook-pipeline\\projects\\english_pipeline_output\\audio\\scene_sec_007_0_line_1.mp3"
    },
    {
      "text": "Look at the question carefully: - a. They build a castle with clay.",
      "duration_seconds": 5.2,
      "pause_after": 0.5,
      "audio_path": "D:\\new_video_pip\\packages\\textbook-pipeline\\projects\\english_pipeline_output\\audio\\scene_sec_007_0_line_2.mp3"
    },
    {
      "text": "Think about your answer before you respond.",
      "duration_seconds": 2.8,
      "pause_after": 0.5,